{
  "case_id": "WITNESS-2026-09-03-OBSERVATION-SERVICE-THIN-SLICE",
  "participant_id": "claude-fable-5-1/sov-witness@2026-09-03",
  "artifact_revision": "169182fe4c7b928d12d98d3ee228d82dd58ec2db",
  "observed": {
    "subject": "observation_service_status = BUILT_THIN_SLICE_SELF_TESTED_REMAINDER_DECLARED_NOT_WITNESSED, with the conformance closure and derived standing in the same commit",
    "record": "witness/observation-service.md",
    "verdict": "NOT-YET",
    "standing_supported": "none",
    "observer_id": "claude-fable-5-1/sov-witness@2026-09-03",
    "observer_independence_basis": "This participant did not build, edit, stage or commit any file under the subject. It read the tree at the named commit, ran the repository's own gates, and drove the service only through ObservationService and RunRecord.from_entries from a scratch directory outside the repository. The subject's own suite was run for its exit code; its results were not taken as evidence of independence. The invocation did not permit a probe file under witness/probes/, so the probe is quoted in full in the record and telemetry.probe is deliberately absent.",
    "observer_relation": "INDEPENDENT_OF_BUILDER_DECLARED_SURFACE_ONLY",
    "observed_at": "2026-09-03T17:30:00Z",
    "observed_state_addresses": [
      "services/observation/src/soveraeign_observation_service/record.py",
      "services/observation/src/soveraeign_observation_service/relation.py",
      "services/observation/src/soveraeign_observation_service/observe.py",
      "services/observation/src/soveraeign_observation_service/service.py",
      "services/observation/src/soveraeign_observation_service/errors.py",
      "services/observation/contracts/service.json",
      "services/observation/contracts/relation-inference.schema.json",
      "services/observation/contracts/observation-request.schema.json",
      "services/observation/tests/test_thin_slice.py",
      "services/observation/tests/test_kernel_parity.py",
      "conformance/kernel_predicates.py",
      "conformance/requirements.py",
      "conformance/run.py",
      "conformance/oracle-controls.json",
      "contracts/phase-progress.json",
      "contracts/status-claims.json",
      "services/asset/scripts/conformance_observations.py",
      "scripts/sovkernel/transitions.py",
      "STATUS.yaml",
      ".clarity/coverage.json",
      "services/host/SERVICE-SPEC.md"
    ],
    "observed_state_digests": [
      "sha256:75a69c0cab48c3d266037a096ed6047b344e7277a31a937c6603932c2c995aff",
      "sha256:38e8f66b0cf3b7fff826070a7771e699d21631cb8fd7c31a78655f2b5e11443f",
      "sha256:f83aaa79edda14db486e303fbb295cb844513f1f158cabbc8a5e513f7ad64337",
      "sha256:d68af63d1fd1a3ffa60425fd1793935b145c23c6b66b30e4794b69736179ac75",
      "sha256:8ce373e72815d7330ce365263acd88431262ffc92b84e43e922e358700cb6539",
      "sha256:621397d46407709671cbfc841041981d5524743de9b6d253ea1bab30deaede62",
      "sha256:2ba4e7d2cbf33ac638ed653894653f6b522377b8b22ab71d69eb4fc259e7f06e",
      "sha256:fd5cb97db1eec5c1f1a997abf86787a7bf2fa8d5d715716d387928f033f79ff9",
      "sha256:6456dd55a4b38b3db4b3c3b140601b91c886f57f2aaed04dfdc34b8386599662",
      "sha256:129e8243ca34a9b663fcbd3887bc012f5b660f4d3e3a51a29e525104fc25a551",
      "sha256:f1d81c804e9270bbe01f37c52f3bf4e38caa054affdfd9b9d8479d50fdd08fd2",
      "sha256:4b2fe7b337e416aee4aab1e3a2681a485aa5f897f999a80ba6504b7326cb203a",
      "sha256:3611b4483e048eec5148c072181d649ca709a1ac02d966cb776a276ed58a673d",
      "sha256:a7bced39d012d6ff752f7daedfc192a7be4f97dd87b66d7d4ba437fa920973ca",
      "sha256:51afdff7d6d7e12f0964523d1abfe89f41a422f8cafbec0e7f0e4cded9159714",
      "sha256:ee5e97659bbd835715df178ded16e2d6fde58ea0538171a61ff984964ca9c319",
      "sha256:27a4a1fd75130439d58a01d1f4b53eb903d87d501d910cb4ae12ea660274c109",
      "sha256:478fe0a065c8da6d0b5fc8e4b61e3260d67f6baff9ba00fadbb087433374343b",
      "sha256:dae8e4f439524b1bf93426df9bb0bbbc52d1f9fd2e0f9896aed5e9b66d45c5e3",
      "sha256:5e5bfedf4ea3cc3dc7931b38af962596d4065bec0d15444871c6331c6485069d",
      "sha256:2ee6b31b9cf464f618dcf9c522b09a01cd6a9c33a89adb84346eac83b2c1301a"
    ],
    "commands": {
      "verify": {"command": "python scripts/verify.py", "exit": 0, "excerpt": "PASS: 50 checks in 14.833s wall; GRADE: SILVER; BUDGET DEBT: 9 check(s) over ceiling"},
      "lint": {"command": "python scripts/lint.py", "exit": 0, "excerpt": "PASS: repository hygiene (1164 text files, 545 Python modules, 10 named debt)"},
      "observation_tests": {"command": "python -m unittest discover -s tests -v (cwd services/observation)", "exit": 0, "excerpt": "Ran 37 tests OK"},
      "oracle": {"command": "python conformance/run.py", "exit": 0, "excerpt": "SUITE PASS cases=33 coverage_gaps=0"},
      "f2_gate": {"command": "python scripts/sov_f2_gate.py", "exit": 1, "excerpt": "44/44 normative predicates carry both fixtures; participants 1/2 bound; OPEN"},
      "phase_progress": {"command": "python scripts/sov_phase_progress.py check", "exit": 0, "excerpt": "44/44 predicates, floor 44; PASS"},
      "baseline": {"command": "python scripts/sov_baseline.py", "exit": 0, "excerpt": "PASS: participant matches its recorded baseline (9 requirements, 8 failing as recorded)"},
      "participant_mode": {"command": "python conformance/run.py --cases conformance/scenarios.json --observations <adapter output> --json", "exit": 1, "excerpt": "suite FAIL coverage_gaps [SPEC-CAPTURE, SPEC-DISCOVERY, SPEC-EFFECTIVE, SPEC-RUN]; PROD-I-2 PASS"}
    },
    "predicate_results": {
      "oracle_controls_count_33": {"held": true},
      "kernel_predicates_merged_into_checks": {"held": true},
      "f2_gate_44_of_44_open_only_on_second_participant": {"held": true},
      "phase_progress_floor_44_no_exclusion": {"held": true},
      "pred_i_2_1_reread_is_real_through_content_store": {"held": true, "detail": "verified_address reads blob bytes at the digest path; adapter reports reread_count 2 and the digest of what came back"},
      "new_defeating_controls_fail_for_their_named_reason": {"held": true, "detail": "no defect string is an incidental missing field"},
      "every_new_control_exercises_every_predicate_it_declares": {"held": false, "detail": "CONF-RUN-DEF declares TRANS-begin_run and TRANS-report_run and produces no begin or report defect (C2)"},
      "no_oracle_rule_removed": {"held": true},
      "oracle_notices_single_rule_deletion": {"held": false, "detail": "9 of 10 sampled rule deletions left SUITE PASS (C3)"},
      "participant_mode_meaning_unchanged": {"held": false, "detail": "REQUIREMENTS = set(CHECKS) adds four permanent coverage gaps to participant runs (C4)"},
      "five_operations_built_and_self_tested": {"held": true},
      "service_never_writes_journal": {"held": true},
      "emitted_records_validate_against_declared_schemas": {"held": true},
      "kernel_settle_run_permits_service_observation_and_refuses_forged_self_observation": {"held": true, "detail": "refusal is the kernel's reporter_id comparison; satisfactory is computed by the test"},
      "independence_walk_has_no_unlisted_route": {"held": false, "detail": "P1: REPORTED actor not an edge, reads INDEPENDENT; P2: second ATTEMPTED executor reads INDEPENDENT (F1, F2)"},
      "every_attempt_leaves_exactly_one_receipt": {"held": false, "detail": "P3 ValueError and P4 KeyError escape with zero receipts (F3)"},
      "run_outcome_names_a_receipt_outcome": {"held": false, "detail": "request-observation records COMMITTED from the presence of a REPORTED entry (F4)"},
      "declared_digest_always_checked": {"held": false, "detail": "malformed OUTPUT digest disables the byte check silently (F5)"},
      "predicates_cannot_read_the_executor_report": {"held": false, "detail": "guard is membership in the executor's own output list; a report listed as output is readable (F7)"},
      "status_and_derived_artifacts_consistent": {"held": true},
      "capability_map_activation_is_measured": {"held": false, "detail": "five observation operations ACTIVE at observation:in-process; composition.py binds no such route (S1)"},
      "clarity_rerecords_are_reviews_under_skill": {"held": false, "detail": "60 receipts re-recorded on a token grep; skill defines record as a completed review (S2)"},
      "no_current_document_quotes_the_retired_status_value": {"held": false, "detail": "services/host/SERVICE-SPEC.md:122 (S3)"}
    },
    "standing_note": "This is an observation. It supports no transition and ratifies nothing."
  },
  "telemetry": {
    "probe_location": "quoted in witness/observation-service.md under Probe; run from a scratch directory outside the repository because the invocation permitted no file under witness/probes/",
    "tree_state": "git status --short empty before and after every command; HEAD 169182fe4c7b928d12d98d3ee228d82dd58ec2db throughout"
  }
}
